{
  "order": 142,
  "slug": "4-the-doctrine-of-the-origin-of-the-body-of-the-lord-jesus",
  "date": null,
  "episodeUrl": "https://player.rss.com/onlyjesus/910445?theme=dark",
  "sermonUrl": "/sermons/DOCTRINE_OF_THE_ORIGIN_OF_THE_BODY_OF_THE_LORD_JESUS.pdf",
  "title": "#4: The doctrine of the origin of the body of the Lord Jesus"
}