{
  "order": 66,
  "slug": "80-jehovah-nissi-the-lord-our-banner-of-victory",
  "date": null,
  "episodeUrl": "https://player.rss.com/onlyjesus/1790712?theme=dark",
  "sermonUrl": "/sermons/JEHOVAH_NISSI_THE_LORD_OUR_BANNER_OF_VICTORY.pdf",
  "title": "#80: Jehovah Nissi: The Lord Our Banner of Victory"
}