{
  "order": 18,
  "slug": "128-the-witch-of-endor-truth-in-the-wrong-place",
  "date": null,
  "episodeUrl": "https://player.rss.com/onlyjesus/2453142?theme=dark",
  "sermonUrl": "/sermons/THE_WITCH_OF_ENDOR_TRUTH_IN_THE_WRONG_PLACE.pdf",
  "title": "#128: The Witch of Endor: Truth in the Wrong Place"
}