{
  "order": 44,
  "slug": "102-embracing-the-divine-mandate-to-share-christ",
  "date": null,
  "episodeUrl": "https://player.rss.com/onlyjesus/2083633?theme=dark",
  "sermonUrl": "/sermons/EMBRACING_THE_DIVINE_MANDATE_TO_SHARE_CHRIST.pdf",
  "title": "#102: Embracing the Divine Mandate to Share Christ"
}