{
  "order": 42,
  "slug": "104-the-unfathomable-love-of-christ-a-love-that-defies-comprehension",
  "date": null,
  "episodeUrl": "https://player.rss.com/onlyjesus/2084031?theme=dark",
  "sermonUrl": "/sermons/THE_UNFATHOMABLE_LOVE_OF_CHRIST_A_LOVE_THAT_DEFIES_COMPREHENSION.pdf",
  "title": "#104: The Unfathomable Love of Christ: a Love that Defies Comprehension"
}