{
  "order": 80,
  "slug": "66-when-europe-cried-desperately-for-the-gospel",
  "date": null,
  "episodeUrl": "https://player.rss.com/onlyjesus/1625567?theme=dark",
  "sermonUrl": "/sermons/WHEN_EUROPE_CRIED_DESPERATELY_FOR_THE_GOSPEL.pdf",
  "title": "#66: When Europe Cried Desperately for the Gospel"
}