{
  "order": 3,
  "slug": "143-the-holy-waste-why-boring-obedience-outlasts-frantic-ministry",
  "date": null,
  "episodeUrl": "https://player.rss.com/onlyjesus/2767866?theme=dark",
  "sermonUrl": "/sermons/THE_HOLY_WASTE_WHY_BORING_OBEDIENCE_OUTLASTS_FRANTIC_MINISTRY.pdf",
  "title": "#143: The Holy Waste: Why Boring Obedience Outlasts Frantic Ministry"
}