{
  "order": 65,
  "slug": "81-jehovah-tsidkenu-the-lord-our-righteousness",
  "date": null,
  "episodeUrl": "https://player.rss.com/onlyjesus/1823795?theme=dark",
  "sermonUrl": "/sermons/JEHOVAH_TSIDKENU_THE_LORD_OUR_RIGHTEOUSNESS.pdf",
  "title": "#81: Jehovah Tsidkenu: The Lord our Righteousness"
}