{
  "order": 118,
  "slug": "28-the-mount-of-olives-where-christ-ascended-and-will-return",
  "date": null,
  "episodeUrl": "https://player.rss.com/onlyjesus/1149727?theme=dark",
  "sermonUrl": "/sermons/THE_MOUNT_OF_OLIVES.pdf",
  "title": "#28: The Mount of Olives: where Christ ascended and will return"
}