{
  "order": 123,
  "slug": "23-give-the-empty-room-to-jesus-a-lesson-in-hospitality-and-faith",
  "date": null,
  "episodeUrl": "https://player.rss.com/onlyjesus/1104193?theme=dark",
  "sermonUrl": "/sermons/GIVE_THE_EMPTY_ROOM_TO_JESUS_A_LESSON_IN_HOSPITALITY_AND_FAITH.pdf",
  "title": "#23: Give the Empty Room to Jesus: A Lesson in Hospitality and Faith"
}