{
  "order": 45,
  "slug": "101-the-seal-of-god-a-divine-mark-of-ownership-authority-and-assurance",
  "date": null,
  "episodeUrl": "https://player.rss.com/onlyjesus/2083571?theme=dark",
  "sermonUrl": "/sermons/THE_SEAL_OF_GOD_A_DIVINE_MARK_OF_OWNERSHIP_AUTHORITY_AND_ASSURANCE.pdf",
  "title": "#101: The Seal of God: A Divine Mark of Ownership, Authority, and Assurance"
}