{
  "order": 109,
  "slug": "37-from-deacon-to-preacher-to-martyr-the-story-of-stephen",
  "date": null,
  "episodeUrl": "https://player.rss.com/onlyjesus/1278094?theme=dark",
  "sermonUrl": "/sermons/FROM_DEACON_TO_PREACHER_TO_MARTYR_THE_STORY_OF_STEPHEN.pdf",
  "title": "#37: From Deacon to Preacher to Martyr: The Story of Stephen"
}