{
  "order": 71,
  "slug": "75-from-bondage-to-belief-the-exodus-of-true-identity",
  "date": null,
  "episodeUrl": "https://player.rss.com/onlyjesus/1733517?theme=dark",
  "sermonUrl": "/sermons/FROM_BONDAGE_TO_BELIEF_THE_EXODUS_OF_TRUE_IDENTITY.pdf",
  "title": "#75: From Bondage to Belief: the Exodus of True Identity"
}