{
  "order": 135,
  "slug": "11-if-jesus-is-the-only-god-to-whom-did-he-pray",
  "date": null,
  "episodeUrl": "https://player.rss.com/onlyjesus/979803?theme=dark",
  "sermonUrl": "/sermons/IF_JESUS_IS_THE_ONLY_GOD_TO_WHOM_DID_HE_PRAY.pdf",
  "title": "#11: If Jesus is the Only God, to Whom Did He Pray?"
}