{
  "order": 47,
  "slug": "99-the-power-of-the-marks-the-significance-of-jesus-wounds",
  "date": null,
  "episodeUrl": "https://player.rss.com/onlyjesus/2023233?theme=dark",
  "sermonUrl": "/sermons/THE_POWER_OF_THE_MARKS_THE_SIGNIFICANCE_OF_JESUS_WOUNDS.pdf",
  "title": "#99: The Power of the Marks: the Significance of Jesus' Wounds"
}