{
  "order": 112,
  "slug": "34-the-crowns-of-victory-a-christian-s-eternal-reward",
  "date": null,
  "episodeUrl": "https://player.rss.com/onlyjesus/1244393?theme=dark",
  "sermonUrl": "/sermons/THE_CROWNS_OF_VICTORY_A_CHRISTIANS_ETERNAL_REWARD.pdf",
  "title": "#34: The Crowns of Victory a Christian's Eternal Reward"
}