{
  "order": 121,
  "slug": "25-stand-still-and-see-the-salvation-of-the-lord",
  "date": null,
  "episodeUrl": "https://player.rss.com/onlyjesus/1125424?theme=dark",
  "sermonUrl": "/sermons/STAND_STILL_AND_SEE_THE_SALVATION_OF_THE_LORD.pdf",
  "title": "#25: Stand Still and see the Salvation of the Lord!"
}