{
  "order": 59,
  "slug": "87-from-filth-to-faith-the-transformative-power-of-god-s-grace",
  "date": null,
  "episodeUrl": "https://player.rss.com/onlyjesus/1900035?theme=dark",
  "sermonUrl": "/sermons/FROM_FILTH_TO_FAITH_THE_TRANSFORMATIVE_POWER_OF_GODS_GRACE.pdf",
  "title": "#87: From Filth to Faith: The Transformative Power of God's Grace"
}