{
  "order": 79,
  "slug": "67-the-necessity-of-baptism-in-jesus-name-alone",
  "date": null,
  "episodeUrl": "https://player.rss.com/onlyjesus/1625569?theme=dark",
  "sermonUrl": "/sermons/THE_NECESSITY_OF_BAPTISM_IN_JESUS_NAME_ALONE.pdf",
  "title": "#67: The Necessity of Baptism in Jesus Name Alone"
}