{
  "order": 52,
  "slug": "94-crafted-for-purpose-the-anointing-of-bezaleel",
  "date": null,
  "episodeUrl": "https://player.rss.com/onlyjesus/1990954?theme=dark",
  "sermonUrl": "/sermons/CRAFTED_FOR_PURPOSE_THE_ANOINTING_OF_BEZALEEL.pdf",
  "title": "#94: Crafted for Purpose: The Anointing of Bezaleel"
}