{
  "order": 98,
  "slug": "48-what-is-the-relation-of-the-spirit-of-god-to-his-flesh-and-blood",
  "date": null,
  "episodeUrl": "https://player.rss.com/onlyjesus/1393449?theme=dark",
  "sermonUrl": "/sermons/WHAT_IS_THE_RELATION_OF_THE_SPIRIT_OF_GOD_TO_HIS_FLESH_AND_BLOOD.pdf",
  "title": "#48: What is the Relation of the Spirit of God to His Flesh and Blood?"
}